{
  "name": "screenshot-organize",
  "version": "0.1.0",
  "description": "把截图按拍摄日期归到 YYYY/MM/ 目录并加时间前缀，命名冲突直接失败而不是覆盖",
  "entry": "./index.ts",
  "capabilities": [
    { "id": "fs.read", "scope": "{{root}}", "reason": "识别截图文件与时间" },
    { "id": "fs.write", "scope": "{{root}}", "reason": "建日期目录并移动/重命名" }
  ]
}
